{
  "schemaVersion": 1,
  "publishId": "pub_20240115_bili_001",
  "themeId": "theme_001",
  "productionId": "prod_20240115_theme_001",
  "platform": "bilibili",
  "status": "published",
  "publishedAt": "2024-01-15T18:03:41Z",
  "url": "https://www.bilibili.com/video/BV1xx411c7mD",
  "platformVideoId": "BV1xx411c7mD",
  "metadata": {
    "title": "30秒看懂：AI 动画是怎么做出来的",
    "description": "从脚本到分镜到渲染，一条 AI 动画的完整生产链路。",
    "tags": ["AI", "动画", "教程", "Remotion"],
    "thumbnail": "data/productions/prod_20240115_theme_001/cover.jpg"
  },
  "precheck": {
    "passed": true,
    "checks": [
      { "name": "duration", "passed": true, "detail": "30s" },
      { "name": "fileSize", "passed": true, "detail": "8.0MB" },
      { "name": "sensitiveWords", "passed": true },
      { "name": "tagCount", "passed": true, "detail": "4/10" },
      { "name": "titleLength", "passed": true, "detail": "18/80" },
      { "name": "coverExists", "passed": true }
    ]
  },
  "initialMetrics": { "views": 0, "likes": 0, "comments": 0 },
  "error": null
}
